{
  "plan_id": "plan_elevenlabs_123",
  "session_id": "sess_elevenlabs_123",
  "attempt_id": "att_1",
  "execution": {
    "placement": "sidecar",
    "provider_route": "provider_direct",
    "credential_source": "managed"
  },
  "expires_at": "2026-08-01T12:00:30Z",
  "route": {
    "provider": "elevenlabs",
    "model": "eleven_flash_v2_5",
    "region": "eu",
    "adapter": "elevenlabs.tts.v1",
    "transport": "websocket",
    "endpoint": "wss://api.elevenlabs.io/v1/text-to-speech",
    "credential": {
      "kind": "bearer",
      "value": "single-use-tts-websocket-token",
      "expires_at": "2026-08-01T12:00:00Z"
    }
  },
  "reservation": {
    "id": "res_elevenlabs_123",
    "lease_duration_seconds": 60,
    "lease_expires_at": "2026-08-01T12:01:00Z",
    "concurrency": {
      "lease_id": "conc_elevenlabs_123",
      "slots": 1
    },
    "usage": {
      "unit": "characters",
      "authorized_units": 4000
    }
  },
  "telemetry": {
    "endpoint": "https://gateway.speko.dev/v1/runtime-events",
    "token": "session-scoped-telemetry-token",
    "flush_interval_ms": 5000
  },
  "fallback": {
    "exchange_url": "https://gateway.speko.dev/v1/sessions/sess_elevenlabs_123/fallback-plans"
  },
  "requirements": {
    "protocol": "speko.voice.v0",
    "protocol_revision": 3,
    "runtime_version": "0.1.0"
  },
  "signature": "test-fixture-not-a-real-signature"
}
